{
  "schema_version": "1.0.0",
  "request_id": "req-0004",
  "generated_at": "2026-10-08T10:03:00+05:30",
  "query": {
    "query_text": "VAT rate on imported vehicles",
    "as_of_date": "2026-10-08",
    "top_k": 5,
    "include_history": false
  },
  "results": [],
  "warnings": [
    "NO_MATCH",
    "PARTIAL_CORPUS_COVERAGE"
  ],
  "metadata": {
    "retrieval_mode": "mock",
    "latency_ms": 0,
    "corpus_version": "mock-2026-10-08",
    "embedding_model": "none (mock)",
    "candidates_considered": 0,
    "confidence_method": "mock"
  }
}
